{
  "planVersion": 1,
  "designRef": {
    "id": "DESIGN-CONTEXT-CONSUMPTION",
    "path": "fixtures/context-consumption.json"
  },
  "shapeVocabularyVersion": "shape-catalog-v1",
  "sourceUnits": [
    {
      "id": "SU-001",
      "section": "§0",
      "kind": "non-goal",
      "statement": "本文只讨论 Context Consumption 的产品语义层级，不是 Feature 合同、架构 SSOT、最终 schema 或实现授权。",
      "importance": "core"
    },
    {
      "id": "SU-002",
      "section": "§0",
      "kind": "boundary",
      "statement": "Context-side chain 与 Output-side chain 保持分离，二者共同支持 context-grounded generation 的产品叙事，但不承诺严格反事实因果。",
      "importance": "core"
    },
    {
      "id": "SU-003",
      "section": "§1",
      "kind": "definition",
      "statement": "Context Consumption 保留 Receipt → Availability → Consumption 三个递进层级。",
      "importance": "core"
    },
    {
      "id": "SU-004",
      "section": "§1",
      "kind": "definition",
      "statement": "Receipt 表示上下文到达了系统；Availability 表示合法、冻结、版本一致的上下文已可被本次生成使用；Consumption 表示本次生成任务实际把其中的教学语义作为课程设计输入。",
      "importance": "core"
    },
    {
      "id": "SU-005",
      "section": "§1",
      "kind": "invariant",
      "statement": "三个层级不能互相替代：Receipt ≠ Availability，Availability ≠ Consumption。",
      "importance": "core"
    },
    {
      "id": "SU-006",
      "section": "§1",
      "kind": "rationale",
      "statement": "Context Influence 若定义为\"生成结果出现可归因于 DeepTutor 上下文的变化或取舍\"，就已经进入 Output Alignment 甚至比它更强，因为它包含反事实与因果意味。",
      "importance": "supporting"
    },
    {
      "id": "SU-007",
      "section": "§1",
      "kind": "target-state",
      "statement": "明确不采用 Receipt → Availability → Consumption → Influence 的四级结构。",
      "importance": "core"
    },
    {
      "id": "SU-008",
      "section": "§2",
      "kind": "definition",
      "statement": "产品语义上保留两条相互关联但不互相吞并的链：Context-side chain 与 Output-side chain。",
      "importance": "core"
    },
    {
      "id": "SU-009",
      "section": "§2",
      "kind": "definition",
      "statement": "Context-side chain 回答：DeepTutor 的冻结教学语义有没有到达本次生成，并被生成任务实际作为课程设计输入使用。",
      "importance": "core"
    },
    {
      "id": "SU-010",
      "section": "§2",
      "kind": "definition",
      "statement": "Output-side chain 回答：最终生成的 outline 和 scene 是否在可观察意义上体现了相关目标、知识范围和教学设计要求。",
      "importance": "core"
    },
    {
      "id": "SU-011",
      "section": "§2",
      "kind": "boundary",
      "statement": "两条链共同支持 context-grounded generation narrative，已经足以构成产品需要的可追踪叙事，不需要额外承诺\"某个具体输出变化严格由 DeepTutor 导致\"。",
      "importance": "core"
    },
    {
      "id": "SU-012",
      "section": "§3",
      "kind": "definition",
      "statement": "Context Receipt 表示 OpenMAIC 或其服务端 Fusion 层收到了一份来自课前语义交换链的上下文结果，至少可以识别它属于某个请求或 session lineage。",
      "importance": "core"
    },
    {
      "id": "SU-013",
      "section": "§3",
      "kind": "boundary",
      "statement": "Receipt 能说明：系统收到了某个 Proposal / 冻结上下文或相关传输结果；传输层或接收层记录了到达事实；后续系统有机会继续进行授权、版本和语义关联检查。",
      "importance": "core"
    },
    {
      "id": "SU-014",
      "section": "§3",
      "kind": "boundary",
      "statement": "Receipt 不能说明：上下文已经通过合法性校验、属于当前生成请求、已经冻结、当前生成一定可以使用它、生成器实际读过或使用了其中的教学语义、最终 outline 或 scene 已经对齐。",
      "importance": "core"
    },
    {
      "id": "SU-015",
      "section": "§3",
      "kind": "negative-case",
      "statement": "以下事实都只能证明 Receipt，不能证明 Availability 或 Consumption：Proposal 到达 HTTP 或消息入口、响应被写入日志、响应被保存到 session、上下文对象出现在内存或数据库中、生成接口的调用参数中存在一个 context 字段。",
      "importance": "core"
    },
    {
      "id": "SU-016",
      "section": "§3",
      "kind": "negative-case",
      "statement": "如果收到的 Proposal 版本未知、请求 lineage 不一致、引用越权或冻结失败，系统仍然可能有 Receipt，但不能继续声称 Availability。",
      "importance": "supporting"
    },
    {
      "id": "SU-017",
      "section": "§4",
      "kind": "definition",
      "statement": "Context Availability 表示合法、冻结、版本一致的课前语义上下文已经准备好，并且在本次 outline generation 的授权边界内可被使用。",
      "importance": "core"
    },
    {
      "id": "SU-018",
      "section": "§4",
      "kind": "invariant",
      "statement": "Availability 至少意味着：来自受信任的服务端路径、请求/session/Frozen Context lineage 一致、schema 与 revision 与 digest 与引用范围和授权关系通过检查、使用的是同一个冻结上下文、仍在有效生命周期内、生成阶段具有访问该合法上下文的服务端能力。",
      "importance": "core"
    },
    {
      "id": "SU-019",
      "section": "§4",
      "kind": "boundary",
      "statement": "Availability 仍然不能说明生成器已经真正使用了上下文；它只说明\"如果生成器需要，它现在可以合法、稳定地使用这份上下文\"。",
      "importance": "core"
    },
    {
      "id": "SU-020",
      "section": "§4",
      "kind": "negative-case",
      "statement": "一个上下文可以有 Receipt 但没有 Availability：digest 与当前请求不一致、包含越权知识引用、Frozen Context 尚未成功创建、context 属于旧 revision、浏览器提交了看似完整但未经服务器授权的上下文、生成请求已经切换到另一个 lesson session。",
      "importance": "core"
    },
    {
      "id": "SU-021",
      "section": "§4",
      "kind": "boundary",
      "statement": "Receipt = 上下文到了；Availability = 合法上下文已经准备好并可用。",
      "importance": "supporting"
    },
    {
      "id": "SU-022",
      "section": "§5",
      "kind": "definition",
      "statement": "Context Consumption 表示本次 outline generation 实际使用了冻结上下文中的教学语义，并将其作为课程设计输入，而不是仅仅收到、保存或附加了上下文。",
      "importance": "core"
    },
    {
      "id": "SU-023",
      "section": "§5",
      "kind": "definition",
      "statement": "被消费的对象是经过验证和冻结的教学语义：学习目标、授权且相关的知识范围、必要前置关系、learner projection、Required design constraints、Recommended approaches、Evaluation Focus、生成约束与范围建议与明确排除项。",
      "importance": "core"
    },
    {
      "id": "SU-024",
      "section": "§5",
      "kind": "non-claim",
      "statement": "Consumption 不要求把 raw Proposal、DeepTutor 内部响应、工具轨迹或模型推理直接交给生成器。",
      "importance": "core"
    },
    {
      "id": "SU-025",
      "section": "§5",
      "kind": "invariant",
      "statement": "Receipt 是\"我们收到了上下文\"；Availability 是\"我们确认它合法、冻结、版本一致，并且本次生成可以使用\"；Consumption 是\"本次生成任务确实把其中的教学语义纳入了课程设计\"。",
      "importance": "core"
    },
    {
      "id": "SU-026",
      "section": "§5",
      "kind": "negative-case",
      "statement": "以下情况都不能单独证明 Consumption：Proposal 被成功接收、Frozen Context 被成功保存、context 在生成请求参数中出现、context 被原样附加到 Prompt、Prompt 长度增加、生成接口成功返回 outline、输出中偶然出现了 Proposal 中的关键词。",
      "importance": "core"
    },
    {
      "id": "SU-027",
      "section": "§5",
      "kind": "boundary",
      "statement": "Prompt 可以是 Consumption 的承载方式，但不是产品定义，也不是充分条件；产品要求的是教学语义成为 outline-design task 的真实输入。",
      "importance": "core"
    },
    {
      "id": "SU-028",
      "section": "§5",
      "kind": "invariant",
      "statement": "Consumption 不要求盲目服从：某项 Recommended 被纳入设计考虑后最终没有采用，仍可能满足 Consumption，会在 Output Alignment 中记录为 Not adopted，但不能伪称为已经采用。",
      "importance": "core"
    },
    {
      "id": "SU-029",
      "section": "§5",
      "kind": "consequence",
      "statement": "如果系统完全没有把某项 guidance 纳入生成设计考虑，问题可能反映 Consumption 不充分，而不应仅由 Output Alignment 的最终采用状态解释。",
      "importance": "core"
    },
    {
      "id": "SU-030",
      "section": "§5",
      "kind": "invariant",
      "statement": "Consumption 不要求最终输出必须明显不同：冻结上下文判断学习者与课程同通用设计一致时，最终 outline 可能与默认 outline 相近。",
      "importance": "core"
    },
    {
      "id": "SU-031",
      "section": "§5",
      "kind": "rationale",
      "statement": "若要求可见差异，系统会为了证明个性化而强行制造结构差异，反而可能破坏合理的课程设计。",
      "importance": "supporting"
    },
    {
      "id": "SU-032",
      "section": "§6",
      "kind": "counterexample",
      "statement": "worked-example-first 反例：Receipt/Availability/Consumption 全为 yes 且课程确实使用了 worked example，但不能确定这个 worked example 是因为 DeepTutor 才出现的，因为默认生成模板本来可能也会生成它。",
      "importance": "core"
    },
    {
      "id": "SU-033",
      "section": "§6",
      "kind": "rationale",
      "statement": "要证明\"没有 DeepTutor 就不会有这个输出\"需要反事实比较、控制变量或其他因果设计，这明显强于当前产品目标，也不是普通 Output Alignment 可以保证的。",
      "importance": "core"
    },
    {
      "id": "SU-034",
      "section": "§6",
      "kind": "target-state",
      "statement": "Context Influence 不作为 Context Consumption 的第四级，也不作为本协议的必要产品状态；它可以在未来研究或实验评估中作为独立问题讨论。",
      "importance": "core"
    },
    {
      "id": "SU-035",
      "section": "§7",
      "kind": "definition",
      "statement": "完整叙事是：本次生成收到并准备了合法、冻结、版本一致的课前教学语义；该语义实际参与了 outline generation；最终生成的 outline 和 scene 又在可观察意义上体现了相关目标、知识范围和教学设计要求。",
      "importance": "core"
    },
    {
      "id": "SU-036",
      "section": "§7",
      "kind": "boundary",
      "statement": "这条叙事可以分别报告两条链的状态，不需要压缩成一个不可解释的\"个性化成功\"布尔值。",
      "importance": "supporting"
    },
    {
      "id": "SU-037",
      "section": "§7",
      "kind": "example",
      "statement": "5 种状态组合各有产品解释：从\"上下文没有到达\"到\"上下文可用但未实际参与生成\"，再到\"形成了完整的 context-grounded generation 证据\"。",
      "importance": "core"
    },
    {
      "id": "SU-038",
      "section": "§7",
      "kind": "non-claim",
      "statement": "即使是最后一种状态仍然不证明：DeepTutor 判断一定正确、课程一定有效、学生一定学会、某个输出变化严格由 DeepTutor 导致。",
      "importance": "core"
    },
    {
      "id": "SU-039",
      "section": "§8",
      "kind": "boundary",
      "statement": "Context Consumption 关注冻结教学语义是否到达并实际参与生成；Output Alignment 关注最终 outline / scene 是否体现相关教学要求。",
      "importance": "core"
    },
    {
      "id": "SU-040",
      "section": "§8",
      "kind": "invariant",
      "statement": "Consumption ≠ Output Alignment，Output Alignment ≠ Consumption。",
      "importance": "core"
    },
    {
      "id": "SU-041",
      "section": "§8",
      "kind": "example",
      "statement": "Consumption = yes 而 Output Alignment = no 表示上下文确实参与了生成，但结果没有满足相关 Required 或没有充分体现目标、范围与教学设计。",
      "importance": "core"
    },
    {
      "id": "SU-042",
      "section": "§8",
      "kind": "example",
      "statement": "Consumption = no 而 Output Alignment = apparently yes 表示结果可能来自默认模板、通用教学模式或偶然相似，不能把它归因于 DeepTutor。",
      "importance": "core"
    },
    {
      "id": "SU-043",
      "section": "§8",
      "kind": "invariant",
      "statement": "这两个目标只有共同成立时，才能支持\"本次课程在可追踪意义上消费并体现了课前教学语义\"。",
      "importance": "supporting"
    },
    {
      "id": "SU-044",
      "section": "§9",
      "kind": "current-state",